Замена клавиатуры C223010701, согласована замена клавиатуры на ноутбуке  c223010701, в рамках гарантийных обязательств
+BB0EPgRDBEIEMQRDBDo- +BCEEGAQbBBA- +BB0EGg-2-1404 s/n C222090381 +BEEEOwQ+BDwEMA-+BDsEQQRP- +BBEEHw- (+BBIEPgQ7BDMEPgQzBEAEMA-+BDQ-), (отвалился разъём type-c), блок питания
СИЛА НК2-3404, были замечены артефакты._x000d_, c223091364_x000d_
Просьба открыть заявку по неисправному диску на dd203 - Enclosure=5:Disk=31, failed disks          1,"
2"
НК2-1404 v2 // Не работает зарядное устройство // C223100822, не работает зарядное устройство,нк2-1404 v2
"Полосы на экране. полосы могут появиться не сразу, а через некоторое время после включения.", включения., включения.
СИЛА НК2-1404 v2 // Неисправность ноутбука //  С223011138," в процессе работы регулярно появляется ""синий экран"","," в процессе работы регулярно появляется ""синий экран"","
IBS. СИЛА C111120016 хрипит левый динамик,"
обновление драйверов на звук не помогло.", ноутбуке
Мерцает экран,мерцает экран. сила hk2-3404 (c223090004),мерцает экран. сила hk2-3404
Сервер СР2-5422 // Ошибки на System Fan 2, появились ошибки по датчику system fan 2,сервер ср2-5422
"HK2-1404 // Не работает порт Type-C, не работает зарядное устройство // C223102038"," не работает порт type-c, не работает зарядное устройство", c223102038.
Ремонт, зарядка не идет (или идет не постоянно)., ноутбуком «сила» hk2-3404.
Ноутбук СИЛА HK-1404 // полосы на экране // C223011328, c223011328.,ноутбук сила hk-1404
Не включается дисплей,не включается дисплей. не включается дисплей,не включается дисплей. не включается дисплей
Ноутбук Сила не работает порт HDMI," ""плавающая"", не постоянная,", внешнего монитора
Гарантийный ремонт СИЛА C223012731, треске, sila hk2-1404
Гарантийный ремонт Т2, кулер цепляет и издает звук), нк2-1404
HK2- 1404 // Не работает звук на ноутбуке //C223011358,hk2- 1404,hk2- 1404
Ноутбук HK2-1404 // Неисправность зарядного устройства ноутбука СИЛА // C223012702," визуально нет следов повреждения,", оба порта type-c
Гарантия,гарантия.,гарантия.
HK2-1404 // Неисправность зарядного устройства ноутбука СИЛА // C223010240," визуально нет следов повреждения,", type-c
вылетели 9 дисков и перезагрузилась резервная нода dd503, failed disks," пассивная нода,"
FW: Гарантийный случай, вышел из строя блок питания., сила нк2-1404 вышел из строя блок питания.
Ноутбук СИЛА HK2-1404 // Неисправность зарядного устройства ноутбука СИЛА // C223012673, неисправность зарядного устройства, неисправность зарядного устройства
HK2-1404 // Проблема с матрицей и портом type-c // C223012100," если нет, то помогает перезагрузка.",hk2-1404
"Аварийная перезагрузка сервера,  UMA operation error","
intel me has encountered uma operation error.", продуктивном контуре
Не работает зарядка Type-C СИЛА НК2-1404 // C223101296, не работает, не работает зарядное устройство
Ноутбук Сила HK2-3404 (SN: C223091736),"
не включается.","
из коробки"
СХД CX4-1127-00 // Неисправный диск // CKM00194301861, the disk state is failed.,схд cx4-1127-00
Ноутбук Сила НК2-3404, драйвера для корпоративной win 10 версия 22h2._x000d_, ноутбуки сила нк2-3404
Ноутбук СИЛА НК2-3404// рябь экрана // c223091025, рябь экрана // c223091025., сила модель нк2-3404 s/n c223091025
НК2-1404 // Не работает Wi-FI (Кашира)// C223101219, не работает wi-fi (кашира)//,нк2-1404
Не работает блок питания (зарядка),не работает блок питания (зарядка)., не работает блок питания (зарядка)
Ноутбук НК2-1404 //Не работает клавиша F1 или срабатывает с задержкой//С223010731,"
после ремонта ноутбука перестала срабатывать кнопка f1",ноутбук нк2-1404
Отказ блока питания,отказ блока питания., нк2-1404
Обновление BIOS и BMC Cube, прошу предоставить для скачивания._x000d_, сила?
