Не работает блок питания,не работает блок питания., сила нк2-1404 v2
Не включается SILA LLC HK2-3404., что можно сделать?_x000d_, пк
Сервер СР2-5422 // Системные ошибки // D251110041, на сервере появились системные ошибки.,сервер ср2-5422
Повреждение матрицы,повреждение матрицы., ноутбука.
sila HK2-1404 c223014125 asset 7101087,"
не включается, нет индикации заряда.","
не включается, нет индикации заряда."
Не работает блок питания,не работает блок питания.,не работает блок питания.
НК2-3404 // Мерцание экрана // C223091001,"
c223091001_x000d_"," стояли в офисе,"
Ноутбук НК2-1404 // Вентилятор трется о сетку // C223012430,"
спустя 30 минут работы вентилятор трется о сетку_x000d_",ноутбук нк2-1404
Неисправность сервера СИЛА // 46920,неисправность сервера сила // 46920., неисправность системы охлаждения сервера
Звук и микрофон не активны на ноутбуке Сила ruc223012961., перестали работать, перестали работать
Ноутбук Сила НК2-1404 v2  SN: C223100312 не работает сетевой адаптер., не работает сетевой адаптер., не работает сетевой адаптер.
Неисправность Ноутбук СИЛА НК2-3404 - NTB48595 (S/N: C223090725), вышла из строя, аппаратная.
"Зависает система, даже без нагрузки.", не реагирует ни на накие кнопки," корп. система, и ""голая"""
dd503.region..ru - Disk 3.2,"
f        failed disks", in use disks
Ноутбук СИЛА HK1-1427/ i5-1135G7/16G/m.2 512Gb/С111120102/инв. № 525600," обновление драйверов пк проблема не устранима,"," usb наушников,"
Сервер СИЛА СР2-5422  // Вышел из строя сетевой SFP модуль // D252110012, нет сигнала,сервер сила ср2-5422
Ноутбук СИЛА HK1-1425/ i5-1135G7/8G/m.2 512Gb/ С112040045 /инв. 525861_ВЛN,"
порт hdmi в ноутбуке уже давно не работает.",ноутбук
СИЛА НК2-1404 \нет загрузочного  диска\C222091500, пропал загрузочный диск._x000d_, \нет загрузочного  диска\c222091500.
Неисправность ноутбука Сила NTB49600 (Платформа) - C223090096, вышла из строя, аппаратная.
Полосы на экране, полосы на экране,полосы на экране. полосы на экране
HK2-1404 // Не работает зарядное устройство // C223102298, перестало работать зарядное устройство.,hk2-1404
НК2-3404 // Мерцание экрана // C223091126,"
мерцает экран,"," стояли в офисе,"
Ноутбук не включается,ноутбук не включается.,ноутбук не включается.
Не работает ноутбук, сброс по питанию проблему не решает., c223013256
Гарантийный ремонт 2-х ноутбуков СИЛА, выявили дефекты изображения, нк2-3404.
HK2-1404 C223013523, повреждена, сила нк2-1404 c223013523
Ноутбук НК2-1404 // Полосы и мерцание на мониторе // C223014561,"
примите пожалуйста заявку на ремонт.",ноутбук нк2-1404
BIOS'ы,"
поделитесь, пожалуйста, последними версиями bios", нк2-1404 и нк2-3404.
"Свежая версия BMC Cube, шаблон для Zabbix","
шаблон для zabbix не появился?", сила cp2-6327?_x000d_
Требуется замена модуля памяти, при проведении теста памяти ошибка повторяется., требуется замена модуля памяти.
Ноутбук СИЛА HK1-1425/i5-1135G7/1*16G/m.2 256G/B3Y/С111080061/инв. №525315, не работает hdmi,ноутбук
Обновление BIOS, не удобно писать заявки на предоставление драйверов., hk2-1404_x000d_
Неисправность сервера СИЛА // 46915,неисправность сервера сила // 46915., системы охлаждения
СИЛА НК2-1404// Замена ЗУ на ноутбуках Сила HK2-1404 (в кол-ве 6 шт.), вышли из строя, сила hk2-1404
Сервер СР2-5422 // После обновления bios и bmc появились ошибки системных кулеров // D251110015,"
сброс логов с последующей перезагрузкой bmc не помогли.",сервер ср2-5422
СИЛА НК2-1404//Драйверы звука и видео пропадают при перезагрузке // C222090246, будьте добры сообщить адрес сервисного центра, будьте добры сообщить адрес сервисного центра
Неприемлемо долгий запуск сервера CP2-5422,"
программная конфигурация у всех трех серверов одинаковая:_x000d_", абсолютно одинаковая._x000d_
мерцает экран ноутбука, мерцает экран ноутбука,мерцает экран ноутбука. мерцает экран ноутбука
СИЛА НК2-1404// Замена ЗУ на ноутбуках Сила HK2-1404 (в кол-ве 5 шт.)// C223012998 C223101389 C223102298  C223100876 C223100050, вышли из строя, сила hk2-1404
Сила КУБ: запрос на обновление прошивки,"
просим предоставить актуальные версии прошивок", сервер ср2-6327._x000d_
заявка на гарантийный ремонт\замену, блок питания не подает заряд, блок питания не подает заряд
HK2-1404 // Не работает кнопка влючения и jack 3.5 // C223011660,"
это не гарантийный ремонт,","
это не гарантийный ремонт,"
"СИЛА НК2-3205 // Перечень проблем с ноутбуками СИЛА // Проблемы при подключении к док-станции, второго монитора //  C233041042", №c233041042_x000d_,"
сила hk2 3205"
СИЛА HK2-1404 // Не работает зарядное устройство // C223011088, не работает зарядное устройство, не работает зарядное устройство // c223011088.
Ноутбук СИЛА HK1-1425/i5-1135G7/8G/m.2 256G/B3Y/С111080030/инв. №367120, не работает hdmi_x000d_," не работает hdmi_x000d_
_x000d_"
Неисправность Ноутбук СИЛА НК2-3404 - NTB48179 S/N: C223091624, система охлаждения центрального процессора., аппаратная.
Сервер СР2-5422 // После обновления bios и bmc перестал работать BMC // D251110011, проблема осталась.,сервер ср2-5422
"СИЛА НК2-1404 // Рябь, мерцание //C223014073"," c223013568,c223014073, c223014954", ноутбуков сила нк2-1404.
"Синий экран, предположительно память.","
есть подозрения на модуль озу.", модуль озу.
HK2-1404 // Проблема с портом type-c // C223012095,"
не работает один порт type-c.",hk2-1404
Гарантийный ремонт," на экране были обнаружены ""помехи""",гарантийный ремонт.
С223091153 - мерцает экран, дисплеи не мерцают, дисплеи не мерцают
полосы на матрице НК2-3404 C223090893,полосы на матрице нк2-3404 c223090893., нк2-3404
СИЛА НК2-3404  // мерцающая матрица // C223090123, мерцающие полосы,"
серийник: c223090123"
"10552. СИЛА HK-1404 // замена блоков питания // C223010423, C223011174"," не работают блоки питания,"," не работают блоки питания,"
Ноутбук СИЛА HK-1404 не заряжается с type-c портов, не заряжается с type-c портов., laptops:
СИЛА HK2-1404 // Неисправность зарядного устройства ноутбука СИЛА // C223011355," визуально нет следов повреждения,", type-c
Ноутбук СИЛА HK1-1425/i5-1135G7/2*8G/m.2 256G/B3Y/ инв. № 525325/ С111080029, не рабочий hdmi,ноутбук
Неисправность Ноутбук СИЛА НК2-3404 - NTB48447 S/N: C223091505, вышла из строя матрица., аппаратная.
Перестал включаться, перестал включаться, перестал включаться
HK2-1404 // Не работает зарядное устройство // C223011313, не работает зарядное устройство, не работает зарядное устройство
СИЛА НК2-1404 // Отвалился разъем type c // C223012413, отвалился разъем type c, отвалился разъем type c
Заряд аккумулятора," отсутствие заряда аккумулятора,"," отсутствие заряда аккумулятора,"
"СИЛА CX-1015-12 // HDD fault //  s/n E213120001. Вышел из строя диск, пришедший на замену по гарантии.", hdd fault, hdd fault
Драйвера НК2-3404 на WIn10x64," звук попросту не идет,", внешних звуковых устройств.
Полосы и мерцание на мониторе, на ноутбуку, сила нк2-3404
глитч матрицы," появление черных полос на экране хаотичное выключение 
экрана,",глитч матрицы.
Неисправность Ноутбук СИЛА НК2-3404 - NTB48532 S/N: C223090552, вышла из строя матрица., аппаратная.
Заявка на гарант,"
ноутбук c223094573","
ноутбук c223094573"
Неисправность диска Enclosure=6:Disk=32 dd202, disk state is failed._x000d_, data domain:_x000d_
СИЛА HK2-1404 // Неисправность зарядного устройства ноутбука СИЛА // C223012685 C223012673 C223011958 C223011355 C223012788," визуально нет следов повреждения,", оба порта type-c
"Ноутбук СИЛА HK-1404 // замена блоков питания // C223012682, C223011343, C223011380"," не работают блоки питания,",ноутбук сила hk-1404
Ноутбук СИЛА HK1-1427/ i5-1135G7/16G/m.2 512Gb/С111120125/инв. № 525823,"
неисправно само устройство, необходим ремонт.","
неисправно само устройство,"
Проблема с серийным номером СИЛА," сохранится ли за ним гарантия,", сила hk2-1404
НК2-1404 // залит водой // C223011324," требуется диагностика, обслуживание и ремонт, по необходимости.", пользователь залил ноутбук
"HK2-3404 // артефакты, двоение изображения // C223090155", полосы на изображении(так же и в bios), bios)
СИЛА НК2-1404 v2 // Неисправность ноутбука // С223011148,"
в процессе работы регулярно появляется ""синий экран"",","
в процессе работы регулярно появляется ""синий экран"","
Проблема с клавиатурой ноутбука,"
перестала работать", сила нк2-1404_x000d_
Неисправность сервера СИЛА//46925,неисправность сервера сила//46925., сервер сила
Ошибки диска Enclosure=4:Disk=49 dd501, the disk state is failed._x000d_, evt-storage-00002:
Неисправность сервера СИЛА  // 46900, модуль управления перестал отвечать, сервер сила
Неисправность сервера // 46909, неисправность системы охлаждения, неисправность системы охлаждения
Ноутбук СИЛА HK1-1425/i5-1135G7/2*8G/m.2 256Gb/В3Y/C111110002/536337_ВЛN," не рабочая кнопка ""g""",ноутбук
Ошибка диска Enclosure=3:Disk=5 на datadomain, the disk state is failed._x000d_, datadomain_x000d_
Сервер СР2-5422 // После обновления bios и bmc появились ошибки системных кулеров // D251110023, не помогло.,сервер ср2-5422
HK2-1404 // Не работает зарядное устройство // C223010066, не работает зарядное устройство, c223010066.
"Ноутбук СИЛА HK-1404 // проблемы с включением, с usb-портом // C223012662", не подключается любые внешние устройства., не подключается любые внешние устройства.
Не загружается ноутбук Сила НК2-3204,"
после изменения в bios", legacy
Ноутбук СИЛА НК2-1404 // не устанавливается система // C223012840, не устанавливается система,ноутбук сила нк2-1404
Неисправность сервера СИЛА//60441,неисправность сервера сила//60441., сервер сила
Ноутбук СИЛА HK1-1425/ i5-1135G7/8G/m.2 256Gb/В3Y/C111110043/525455, не рабочий hdmi,ноутбук
Ноутбук Сила HK2-1404\ Модернизация WiFi антенны //  C223010918, модернизация wifi антенны //  c223010918.,ноутбук сила hk2-1404\
Неисправность ноутбука СИЛА НК2-3404 - NTB48569, скорее всего неисправность аппаратная., аппаратная.
СИЛА НК2-1404 // Погнутость крышки // С223012632," обнаружили погнутость крышки,",сила нк2-1404
Ноутбук НК2-1404 \\ C223012010 \\ wi-fi," пропадает соединение и в устройствах не отображается,",ноутбук
Hа: Ноутбук Сила ООО Газпром бурение, полное обнуление ssd, ноутбук сила
СИЛА HK2  C223012606 C223012600 C223012675 C223011979 C223012790 абгрейд антенн, апгрейда антенн, абгрейд антенн.
Ноутбук не включается,ноутбук не включается.,ноутбук не включается.
Ноутбук СИЛА HK-1404 // Разбит экран // C223011480, отключается экран во врем работы.,ноутбук сила hk-1404
Перезагрузился сервер. После перезагрузки не включается., error1)., при перезагрузке ошибка повторяется.
Неисправность ноутбука Сила, вышла из строя матрица., аппаратная.
вопрос по ремонту,"
на первом не работает вентилятор,","
на первом не работает вентилятор,"
Сервер СР2-5422 // D251110008,"
сейчас на сервере наблюдаем ошибки.",сервер ср2-5422
открыть кейс по неисправному диску на dd:  dd203..ru  Enclosure=3:Disk=49, failed disks          1, a( 1-12)
Мерцает матрица ноутбука, при включении ноутбука сила hk2-1404, hk2-1404
HK2-1404 // Не работает зарядное устройство // C223101193, не работает зарядное устройство, не работает зарядное устройство
НК2-1404 // Проблемы с зарядными устройствами // C223012685 C223010230 C223010386,"
вышли из строя зарядные устройства.", c223012685 c223010230 c223010386
не работоспособность BMC, invalid username or password_x000d_," 4 шт,"
СИЛА HK2-1404// Не работает зарядное устройство// C223100876, перестало работать зарядное устройство., не работает зарядное устройство// c223100876.
Ноутбук СИЛА НК2-1404  // мерцание экрана // C223013328,"
мерцание монитора", ноутбука:
HK2-1404 // Не работает зарядное устройство // C223010034, не работает зарядное устройство, не работает зарядное устройство
СИЛА HK-1404 // Рябит экран // C223012603," рябит экран, видео в описании."," рябит экран,"
по неисправной плашке памяти на dd203 - Enclosure=1:DIMM=MR2 DIMM A0, a memory card has failed, critical   hardwarefailure
полосы на экране и отклеились ножки, специально поймать данную неисправность не удается., специально поймать данную неисправность не удается.
ноутбук НК2-1404 - не работает USB gjhn, не работает usb,ноутбук нк2-1404
HK2-1404 // Не работает зарядное устройство // C223011966, не работает зарядное устройство,hk2-1404 // не работает зарядное устройство
C223010721 не работает БП," c223010721 не работает бп,"," c223010721 не работает бп,"
не работоспособность BMC, invalid username or password_x000d_," 4 шт,"
C223010310 / шумит кулер / отклеились ножки, (треск), ноутбука
СИЛА НК2-1404 // Не включается // C223012410, не включается, трещат вентиляторы
Неисправность Ноутбук СИЛА НК2-3404 - NTB48577 S/N: C223090551, вышла из строя матрица., аппаратная.
Неисправность сервера СИЛА // 46917,неисправность сервера сила // 46917., сервер cp2 – 5422_x000d_
НК2-1404 // Не работает З.У. // C223101538," перрестало работать зарядное устройство,", не заряжает ноутбук.
10979. Ноутбук СИЛА НК2-1404 // не включается // C223012335, не включается // c223012335., ноутбук сила нк2-1404
Сервер СР2-5422 // После обновления bios и bmc появились ошибки системных кулеров // D251110031, нулевое значение оборотов системных кулеров,сервер ср2-5422
Не работает блок питания,не работает блок питания. не работает блок питания,не работает блок питания. не работает блок питания
СИЛА НК2-1404 // не работает LAN порт // С222090774, действует ли гарантия,"
ноутбук"
Неисправность сервера СИЛА // 46923,неисправность сервера сила // 46923., неисправность системы охлаждения сервера
HK2-1404 // шумит кулер + артефакты на экране ноутбука // C223010327, sn:c223010327., excel
Неисправность ноутбука Сила, вышла из строя матрица., аппаратная.
СИЛА НК2-1404//нет звука и видеосигнала // C222091964, нк2-1404//нет звука и видеосигнала, нк2-1404//нет звука и видеосигнала
НК2-1404 // Не работает Wi-FI (Кашира)// C223101179, не работает wifi,нк2-1404
Ноутбук Сила. Гарантийный ремонт, не включается, не включается
СИЛА НК2-1404  // Не работает зарядное устройство Type-C // C223010757, не работает зарядное устройство type-c,"
ноутбук от другого устройста заряжается корректно."
Просьба открыть заявку по неисправному диску:  dd401..ru - Disk 3.23 SN: ZC1BYZ1X, the disk state is failed., shsa
Драйвера для ноутбука СИЛА НК2-3404, win10 отказывается ставить даже половину драйверов., если у вас имеется пак драйверов для win 10
Сила НК2-1404 / перестало работать зарядное устройство для ноутбука/ C223100251,"
прошу заменить по гарантии","
прошу заменить по гарантии"
Ноутбук СИЛА HK1-1425/ i5-1135G7/8G/m.2 256Gb/В3Y/С111110066/инв. № 525467, не рабочий первый  tipe-c, не рабочий первый  tipe-c
СИЛА HK2-1404 // Краш SSD  // C223012059, на ноутбуке крашится ssd., ноутбуке
HK2- 1404 // Не работает залипание клавиш  F G  H  отваливается кнопка Backspace //C223010731, не работает залипание клавиш  f g  h,hk2- 1404
гарантийный ремонт.Отпала клавиша, отпала клавиша «8»., ноутбук
Ноутбук СИЛА HK1-1425/ i5-1135G7/8G/m.2 256Gb/C111110003/инв. 525698," не работает hdmi_x000d_
_x000d_"," не работает hdmi_x000d_
_x000d_"
ремонт ноутбука СИЛА НК2-1404, не работает порт usd и порт type-c,ремонт
СИЛА НК2-1404 // Сломался разъема Адаптера питания// С222090230, сломался разъем адаптера питания, ноутбука
нк2-1404 C223013824,"
повреждена", ноутбук сила
СИЛА HK2-1404 // Неисправность зарядного устройства ноутбука СИЛА // C223011958," визуально нет следов повреждения,", type-c
СИЛА НК2-3205 // Установка дополнительной планки памяти // C233041869, c233041869, sn: c233041869
Неисправность сервера СИЛА // 46919,неисправность сервера сила // 46919., неисправность системы охлаждения
сломался блок питания нотубка Сила НК2-1404 v2 SN:  C223101457," отвалился штекер,", ноутбука.
СИЛА НК2-1404//нет звука // C222091827, нк2-1404//нет звука, нк2-1404//нет звука // c222091827.
открыть кейс по неисправному диску на dd:  dd204.region..ru  Enclosure=2:Disk=12, failed disks          1, disk 2.12
"СИЛА НК2-1404 // Рябь, мерцание //C223014954","
рябь на ноутбуках/мерцание.","
рябь на ноутбуках/мерцание."
Неисправность сервера // 46906, неисправность системы охлаждения сервера., сервер cp2 – 5422
"ноутбук НК2-1404, sn-C222091591"," перестал определяться  nvme ssd-накопитель,"," nvme ssd-накопитель,"
Не работает дисплей,не работает дисплей., не работает дисплей ноутбука.
"СИЛА СХ2-4115-12; СИЛА CX2-4016-25; СИЛА СХ2-4066-36  //  обновить ПО до последней версии // E244030001, E244030002, E244030003", хотим обновить по до последней версии.," схд,"
Проблема с ноутбуком СИЛА HK2-1404, вышел из строя ssd, ssd
Проблема с изображением на дисплее,"
прошу забрать для диагностики.", отображением информации на дисплее.
